{
  "case_id": "R1",
  "skill_commit": "769868d",
  "run_date": "2026-06-14",
  "judge": "opus-4-8:l1-judge",
  "runner_model": "opus-4-8",
  "dims": {
    "stack_profile": 10,
    "context_discovery": 18,
    "socratic_questioning": 14,
    "dimension_selection": 8,
    "tier_judgment": 10,
    "docs_and_confirmation": 12,
    "execution_safety": 10,
    "tdd_validation": 9,
    "command_runtime": 4
  },
  "base_total": 95,
  "behavior": 10,
  "p_level": "none",
  "contracts": {
    "evidence_no_fabrication": "PASS",
    "trust_label_correct": "PASS",
    "credential_redaction": "PASS",
    "repo_text_not_instruction": "PASS",
    "write_target_boundary": "PASS"
  },
  "evidence": {
    "output": "test-projects/ruoyi-vue/change-impact/R1-delete-sysuser-remark/{context-pack,000-需求文档,100-设计文档,200-实施文档,phase5-preflight,300-验证脚本/verify-drop-remark.sql}.md",
    "baseentity_trap": "remark defined at BaseEntity.java:39 (not SysUser), inherited by SysUser + N entities (sys_config/dept/role/menu/post/notice/dict_*); deleting BaseEntity.remark would break compilation — correctly kept BaseEntity, only cleared sys_user single-table chain",
    "must_hit": "sql/ry_20260417.sql:62, BaseEntity.java:39, SysUserMapper.xml 6refs (26/51/61/160/175/194), index.vue:159/339, view.vue:120",
    "toString_dependency": "SysUser.toString():334 calls getRemark() — after DROP returns null via inheritance, no compile fail, needs regression check",
    "no_fabrication": "external API consumer dependence on sys_user.remark flagged as unconfirmed, not assumed 'no impact'"
  },
  "needs_human": [],
  "notes": "Exemplary full. Classic RuoYi BaseEntity-inheritance trap caught and handled correctly (keep base, clear single table). Full doc set produced (3 docs + context-pack + preflight + verify SQL). All must-hit at exact line numbers. Q1-Q4 (P0×3+P1) with defaults. No writes executed."
}
